{
  "schema_version": 1,
  "product_name": "project-control",
  "package_version": "0.3.1",
  "source_parent_commit": "12cce58ba960297d49083f74c41b54de978a029c",
  "source_tree_hash": "ae09c6b3b2311cf70d5624299b22b2138a26b7f84e20f14fd23f5a3f37032ff6",
  "project_control_tool_schema_version": 3,
  "observer_tool_names": [
    "project_overview",
    "project_delta",
    "project_frontier",
    "inspect",
    "evidence",
    "plan_preview",
    "agent_status",
    "performance_status",
    "architecture_context",
    "coordination_view",
    "source_context",
    "history_trace",
    "impact_preview",
    "program_context",
    "terminal_capture"
  ],
  "observer_schema_hashes": {
    "agent_status": "15065af772af4bb13c5a717e55eb122dcc116635a45c9413ce6da21710caa0b2",
    "architecture_context": "18d23a7572db9126d06945dda0eff15f98e8ec5983647ddd62144440e281e81e",
    "coordination_view": "470dae037b5460bec0b8c1d8450525be878b04385d235c8cb3cb7e6cb20b39bb",
    "evidence": "6fcb2f398f87c0517dc4a1324c7f4c89acff7ae4a1e069fe4d4dda52a7edf556",
    "history_trace": "2089fda1a35f72b6700b2aded9d521b4b31bdb2c21026438f41f34b57a6d3abe",
    "impact_preview": "fb7581b9cf10d63090eefe5bbbf2d152fc74beb085c81fcf501fb7ee4a095d71",
    "inspect": "b2bc28930f470d4319b0d16d92fad47e2b6fe3ea44c9612f32eb2aef4b967d5c",
    "performance_status": "c50251ba7af1c1ff5659c218e93f489d8826dc68c330ddaa1b68f9c5219547b7",
    "plan_preview": "3b34bfc5c59670fe82df3fac81f746c9b0401093403bad6459895ca31e94dda9",
    "program_context": "8dffbb402cec796026659a94db8e550df00c4baeb6e87050f1aabda84e246263",
    "project_delta": "cc68d06bd9a500c977ce74628f02a6362f44ac4413d5c43c0603a75a4cbf3214",
    "project_frontier": "ad4c2888841c1395c612fe56427a8a6f6b36454aafe0eea1301ea5d2cea56061",
    "project_overview": "42e86341f8b3869562c721e1cbd7f3e9f025a87f14182feb860b5e2763590b83",
    "source_context": "7f0f61c5d6116b28e30976cd3c95071eb99fab9fae4d7c22e1318fbc1aa8cc97",
    "terminal_capture": "ea82a2b87a65912655f5bcc9c418db4088d8c5b6da4ff586bb4b9246e684bbd4"
  },
  "codex_tool_names": [
    "next_task",
    "inspect_task",
    "coordinate_task",
    "delegate_task",
    "collect_delegation",
    "finish_task",
    "project_overview",
    "project_delta",
    "project_frontier",
    "inspect",
    "evidence",
    "plan_preview",
    "agent_status",
    "performance_status",
    "architecture_context",
    "coordination_view",
    "source_context",
    "history_trace",
    "impact_preview",
    "program_context"
  ],
  "codex_schema_hashes": {
    "agent_status": "15065af772af4bb13c5a717e55eb122dcc116635a45c9413ce6da21710caa0b2",
    "architecture_context": "18d23a7572db9126d06945dda0eff15f98e8ec5983647ddd62144440e281e81e",
    "collect_delegation": "6b28c952731381eabcdc0d08f2c18cd99e273f54cdbe3a5f4474d9d94c0d8fbe",
    "coordinate_task": "d63f19aa4481c8688efc7b0169f98b593a15f4011306b344672fed330d54fa9a",
    "coordination_view": "470dae037b5460bec0b8c1d8450525be878b04385d235c8cb3cb7e6cb20b39bb",
    "delegate_task": "643e69f3b7ac68b282d08d65834bbdb84dd1a48ca2580427e66ec9a8287860e0",
    "evidence": "6fcb2f398f87c0517dc4a1324c7f4c89acff7ae4a1e069fe4d4dda52a7edf556",
    "finish_task": "cf928af2af4ee86faf9f72a9d06cffb8e31771730b72bcd944027d783c8f9acd",
    "history_trace": "2089fda1a35f72b6700b2aded9d521b4b31bdb2c21026438f41f34b57a6d3abe",
    "impact_preview": "fb7581b9cf10d63090eefe5bbbf2d152fc74beb085c81fcf501fb7ee4a095d71",
    "inspect": "b2bc28930f470d4319b0d16d92fad47e2b6fe3ea44c9612f32eb2aef4b967d5c",
    "inspect_task": "0aea840e0a05e9e23af338d778e03b81b5c66cec7ab45c00a3a07495de2e26bf",
    "next_task": "e8d4e7b4532e3909a89d6733f52eda383a9ce3c663694a28bac7770e2e7d2419",
    "performance_status": "c50251ba7af1c1ff5659c218e93f489d8826dc68c330ddaa1b68f9c5219547b7",
    "plan_preview": "3b34bfc5c59670fe82df3fac81f746c9b0401093403bad6459895ca31e94dda9",
    "program_context": "8dffbb402cec796026659a94db8e550df00c4baeb6e87050f1aabda84e246263",
    "project_delta": "cc68d06bd9a500c977ce74628f02a6362f44ac4413d5c43c0603a75a4cbf3214",
    "project_frontier": "ad4c2888841c1395c612fe56427a8a6f6b36454aafe0eea1301ea5d2cea56061",
    "project_overview": "42e86341f8b3869562c721e1cbd7f3e9f025a87f14182feb860b5e2763590b83",
    "source_context": "7f0f61c5d6116b28e30976cd3c95071eb99fab9fae4d7c22e1318fbc1aa8cc97"
  },
  "todo_kernel_contract_hash": "51ca97ca0cf3db2b80637d6505be9d5578c6508b98b2902cf760bc2b2b998c32",
  "profile_contract_hash": "6d190adc74b1dd3cd8b9ec768fb2f0920523ebea051a452752854cc5da3556c9",
  "migration_contract_hash": "62d48c99f22fab9681a0227b1a8c700613448c97316fc512ab8a8cf06062b84b",
  "installer_contract_hash": "02a42b52aa3108cee16ee1a3a8d9d738753087553415c6d8391b40208f5b5608",
  "test_evidence_digest": "03065aa350e0c84b1f32370b0c3eeffee43b95d28833676333fc371c449db073",
  "supported_todo_schema_versions": [
    2
  ],
  "supported_project_front_doors": [
    "project-control",
    "coding-workflow"
  ],
  "compatibility_aliases": [
    "coding-workflow",
    "CODING_WORKFLOW_SKILLS_ROOT"
  ],
  "created_at": "2026-08-30T15:11:36Z",
  "authority_to_install": false
}
